"","pubid","title","author","journal","number","cites","year","cid"
"201","Tyk-4Ss8FVUC","Characterisation of genome-wide association epistasis signals for serum uric acid in human population isolates","W Wei, G Hemani, AA Hicks, V Vitart, C Cabrera-Cardenas, P Navarro, et al","PLoS One","6 (8), e23836",18,2011,"1572772075669305808"
"202","2VqYfGB8ITEC","Use of non-invasive methods to collect DNA for genome wide analysis from companion animals","AT French, R Ogden, C Eland, G Hemani, B Corcoran, KM Summers","Advances in Animal Biosciences","2 (1), 53",0,2011,NA
"203","LkGwnXOMwfcC","A Comparison of CPU and OpenCL Parallelization Methods for Correlation and Graph Layout Algorithms used in the Network Analysis of High Dimensional Data","A Theocharidis, G Hemani, M Kargas, TC Freeman","","",0,2011,NA
"204","5nxA0vEk-isC","Extensive QTL and association analyses of the QTLMAS2009 Data","G Hadjipavlou, G Hemani, R Leach, B Louro, J Nadaf, S Rowe, et al","BMC proceedings","4 (1), 1-6",4,2010,"8888677352776078372"
"205","tS2w5q8j5-wC","Association between telomere length and risk of cancer and non-neoplastic diseases","PC Haycock, S Burgess, A Nounu, J Zheng, GN Okoli, J Bowden, et al","JAMA Oncol","2017, 1-1",1,NA,"484716943767830251"
"206","M7yex6snE4oC","DNA methylation mediates genetic liability to non-syndromic cleft lip/palate","M Knapp, E Stergiakouli, B St Pourcain, GD Smith, J Sandy, CL Relton, et al","","",0,NA,NA
