"","pubid","title","author","journal","number","cites","year","cid"
"102","70eg2SAEIzsC","Appraising the causal relevance of DNA methylation for risk of lung cancer","T Battram, RC Richmond, L Baglietto, PC Haycock, V Perduca, et al","International journal of epidemiology","48 (5), 1493-1504",42,2019,"8561944521523927802"
"103","XiVPGOgt02cC","Association of schizophrenia risk with disordered niacin metabolism in an Indian genome-wide association study","S Periyasamy, S John, R Padmavati, P Rajendren, P Thirunavukkarasu, et al","JAMA psychiatry","76 (10), 1026-1034",40,2019,"4474398646932498192"
"104","5ugPr518TE4C","A Mendelian Randomization dictionary: Useful definitions and descriptions for undertaking, understanding and interpreting Mendelian Randomization studies","DA Lawlor, K Wade, MC Borges, T Palmer, FP Hartwig, G Hemani, et al","OSF Preprints","",32,2019,"12716839791672081013"
"105","XiSMed-E-HIC","Calculating power to detect maternal and offspring genetic effects in genetic association studies","GH Moen, G Hemani, NM Warrington, DM Evans","Behavior Genetics","49 (3), 327-339",26,2019,"13992991689824675821"
"106","olpn-zPbct0C","A Phenome-Wide Mendelian Randomization Study of Pancreatic Cancer Using Summary Genetic DataMR-PheWAS of Pancreatic Cancer Using Summary Genetic Data","RJ Langdon, RC Richmond, G Hemani, J Zheng, KH Wade, et al","Cancer Epidemiology, Biomarkers & Prevention","28 (12), 2070-2078",25,2019,"14277583010253431316"
"107","EUQCXRtRnyEC","Evidence for DNA methylation mediating genetic liability to non-syndromic cleft lip/palate","LJ Howe, TG Richardson, R Arathimos, L Alvizi, MR Passos-Bueno, et al","Epigenomics","11 (2), 133-145",25,2019,"15790838339182543181"
"108","Mojj43d5GZwC","Pathways between early‐life adversity and adolescent self‐harm: the mediating role of inflammation in the Avon Longitudinal Study of Parents and Children","AE Russell, J Heron, D Gunnell, T Ford, G Hemani, C Joinson, P Moran, et al","Journal of child psychology and psychiatry","60 (10), 1094-1103",24,2019,"1143477375144404047"
"109","pqnbT2bcN3wC","Prenatal alcohol exposure and facial morphology in a UK cohort","LJ Howe, GC Sharp, G Hemani, L Zuccolo, S Richmond, SJ Lewis","Drug and Alcohol Dependence","197, 42-47",18,2019,"9432840165882008049"
"110","BrmTIyaxlBUC","Mendelian randomization evaluation of causal effects of fibrinogen on incident coronary heart disease","CK Ward-Caviness, PS De Vries, KL Wiggins, JE Huffman, LR Yanek, et al","PloS one","14 (5), e0216222",16,2019,"14422713406043289389"
"111","wbdj-CoPYUoC","An integrative approach to detect epigenetic mechanisms that putatively mediate the influence of lifestyle exposures on disease susceptibility","TG Richardson, RC Richmond, TL North, G Hemani, G Davey Smith, et al","International journal of epidemiology","48 (3), 887-898",14,2019,"8819347255223613424"
"112","tOudhMTPpwUC","Investigating the causal relationship between neuroticism and depression via Mendelian randomization","D Speed, G Hemani, MS Speed, AD Børglum, SD Østergaard","Acta psychiatrica Scandinavica","139 (4), 395",14,2019,"4385155008781231677,14761986286345992137"
"113","4fKUyHm3Qg0C","Using genetic instruments to estimate interactions in mendelian randomization studies","TL North, NM Davies, S Harrison, AR Carter, G Hemani, E Sanderson, et al","Epidemiology","30 (6), e33-e35",11,2019,"7337130012198545279"
"114","u_35RYKgDlwC","Schizophrenia risk and reproductive success: a Mendelian randomization study","RB Lawn, HM Sallis, AE Taylor, RE Wootton, GD Smith, NM Davies, et al","Royal Society open science","6 (3), 181049",9,2019,"12036642687880661721"
"115","K3LRdlH-MEoC","Schizophrenia liability shares common molecular genetic risk factors with sleep duration and nightmares in childhood","ZE Reed, HJ Jones, G Hemani, S Zammit, OSP Davis","Wellcome Open Research","4",9,2019,"16008402807466369102,16500103140959313469"
"116","pyW8ca7W8N0C","Alcohol consumption and mate choice in UK Biobank: comparing observational and Mendelian randomization estimates","LJ Howe, DJ Lawson, NM Davies, BS Pourcain, SJ Lewis, GD Smith, et al","bioRxiv","418269",5,2019,"9721641481046799614"
"117","J-pR_7NvFogC","Comment on the Relationship Between Common Variant Schizophrenia Liability and Number of Offspring in the UK Biobank","RB Lawn, HM Sallis, AE Taylor, RE Wootton, G Davey Smith, NM Davies, et al","American Journal of Psychiatry","176 (7), 573-574",1,2019,"2364214216702499667"
"118","kRWSkSYxWN8C","Publisher Correction: Genome-wide association meta-analysis of individuals of European ancestry identifies new loci explaining a substantial fraction of hair color variation …","PG Hysi, AM Valdes, F Liu, NA Furlotte, DM Evans, V Bataille, A Visconti, et al","Nature Genetics","51 (7), 1190-1190",1,2019,"4407163861085802348"
"119","uLbwQdceFCQC","Publisher Correction: Genome-wide association meta-analysis of individuals of European ancestry identifies new loci explaining a substantial fraction of hair color variation …","PG Hysi, AM Valdes, F Liu, NA Furlotte, DM Evans, V Bataille, A Visconti, et al","","",0,2019,NA
"120","3s1wT3WcHBgC","The MR-Base platform supports systematic causal inference across the human phenome","G Hemani, J Zheng, B Elsworth, KH Wade, V Haberland, D Baird, et al","elife","7",2202,2018,"5805487985630309939"
"121","SeFeTyx0c_EC","Evaluating the potential role of pleiotropy in Mendelian randomization studies","G Hemani, J Bowden, G Davey Smith","Human molecular genetics","27 (R2), R195-R208",538,2018,"3994309054997688647"
"122","08ZZubdj9fEC","Genome-wide association analyses identify 143 risk variants and putative regulatory mechanisms for type 2 diabetes","A Xue, Y Wu, Z Zhu, F Zhang, KE Kemper, Z Zheng, L Yengo, et al","Nature communications","9 (1), 1-14",459,2018,"2406570209186643212"
"123","NhqRSupF_l8C","Unraveling the polygenic architecture of complex traits using blood eQTL metaanalysis","U Võsa, A Claringbould, HJ Westra, MJ Bonder, P Deelen, B Zeng, et al","BioRxiv","447367",429,2018,"6578196114977590979"
"124","4JMBOYKVnBMC","Meffil: efficient normalization and analysis of very large DNA methylation datasets","JL Min, G Hemani, G Davey Smith, C Relton, M Suderman","Bioinformatics","34 (23), 3983-3989",185,2018,"6307686502051562586,11409468643413173770"
"125","a0OBvERweLwC","Invited commentary: detecting individual and global horizontal pleiotropy in Mendelian randomization—a job for the humble heterogeneity statistic?","J Bowden, G Hemani, G Davey Smith","American journal of epidemiology","187 (12), 2681-2685",106,2018,"977110515815320740"
"126","g5m5HwL7SMYC","Genome-wide association meta-analysis of individuals of European ancestry identifies new loci explaining a substantial fraction of hair color variation and heritability","PG Hysi, AM Valdes, F Liu, NA Furlotte, DM Evans, V Bataille, A Visconti, et al","Nature genetics","50 (5), 652-656",90,2018,"13488140710357348738"
"127","D03iK_w7-QYC","Genetic association of albuminuria with cardiometabolic disease and blood pressure","ME Haas, KG Aragam, CA Emdin, AG Bick, G Hemani, GD Smith, et al","The American Journal of Human Genetics","103 (4), 461-473",82,2018,"2964245894650733114"
"128","rO6llkc54NcC","Systematic Mendelian randomization framework elucidates hundreds of CpG sites which may mediate the influence of genetic variants on disease","TG Richardson, PC Haycock, J Zheng, NJ Timpson, TR Gaunt, et al","Human molecular genetics","27 (18), 3293-3304",62,2018,"15125610728184780263,12230543236962636547"
"129","DUooU5lO8OsC","Causal effects of lifetime smoking on risk for depression and schizophrenia: Evidence from a Mendelian randomisation study","RE Wootton, RC Richmond, BG Stuijfzand, RB Lawn, HM Sallis, et al","Biorxiv","381301",57,2018,"1421011043520260413"
"130","ldfaerwXgEUC","Genome-wide association study identifies nine novel loci for 2D:4D finger ratio, a putative retrospective biomarker of testosterone exposure in utero","NM Warrington, E Shevroja, G Hemani, PG Hysi, Y Jiang, A Auton, et al","Human molecular genetics","27 (11), 2025-2038",51,2018,"9111647093724547714"
"131","fPk4N6BV_jEC","PhenoSpD: an integrated toolkit for phenotypic correlation estimation and multiple testing correction using GWAS summary statistics","J Zheng, TG Richardson, LAC Millard, G Hemani, BL Elsworth, et al","Gigascience","7 (8), giy090",44,2018,"1538400424860678361,1080296890389437879"
"132","35N4QoGY0k4C","Investigating the shared genetics of non-syndromic cleft lip/palate and facial morphology","LJ Howe, MK Lee, GC Sharp, G Davey Smith, B St Pourcain, JR Shaffer, et al","PLoS genetics","14 (8), e1007501",40,2018,"16477472617158755568"
"133","M05iB0D1s5AC","Common genetic variants and health outcomes appear geographically structured in the UK Biobank sample: old concerns returning and their implications","S Haworth, R Mitchell, L Corbin, KH Wade, T Dudding, A Budu-Aggrey, et al","BioRxiv","294876",29,2018,"9890282899505574162"
"134","RYcK_YlVTxYC","Identification of loci where DNA methylation potentially mediates genetic risk of type 1 diabetes","J Ye, TG Richardson, WL McArdle, CL Relton, KM Gillespie, M Suderman, et al","Journal of Autoimmunity","93, 66-75",19,2018,"10709551208020198803"
"135","ZHo1McVdvXMC","Genome-wide survey of parent-of-origin effects on DNA methylation identifies candidate imprinted loci in humans","G Cuellar Partida, C Laurin, SM Ring, TR Gaunt, AF McRae, PM Visscher, et al","Human molecular genetics","27 (16), 2927-2939",14,2018,"270829984224141265"
"136","iH-uZ7U-co4C","Partitioning phenotypic variance due to parent-of-origin effects using genomic relatedness matrices","C Laurin, G Cuellar-Partida, G Hemani, GD Smith, J Yang, DM Evans","Behavior genetics","48 (1), 67-79",8,2018,"15998931025597689885"
"137","dfsIfKJdRG4C","Systematic evaluation of the causal relationship between DNA methylation and C-reactive protein","E Walton, G Hemani, A Dehghan, C Relton, GD Smith","bioRxiv","397836",3,2018,"9039599959142206840"
"138","2P1L_qKh6hAC","Tendency towards being a “morning person” increases risk of Parkinson’s disease: Evidence from mendelian randomisation","AJ Noyce, DA Kia, K Heilbron, JEC Jepson, G Hemani, DA Hinds, et al","BioRxiv","288241",3,2018,"14294075682639081912"
"139","p2g8aNsByqUC","What explains the effect of education on cardiovascular disease? Applying Mendelian randomization to identify the consequences of education inequality","AR Carter, D Gill, NM Davies, AE Taylor, T Tillmann, J Vaucher, et al","bioRxiv","488254",2,2018,"17591112932387928397"
"140","vV6vV6tmYwMC","DNA methylation mediates genetic liability to non-syndromic cleft lip/palate","LJ Howe, TG Richardson, R Arathimos, L Alvizi, MR Passos-Bueno, et al","bioRxiv","256842",1,2018,"1436766712642784681"
"141","_xSYboBqXhAC","Trans-ethnic genome-wide association study of kidney function provides novel insight into effector genes and causal effects on kidney-specific disease aetiologies","AP Morris, TH Le, H Wu, A Akbarov, PJ van der Most, G Hemani, et al","bioRxiv","420273",0,2018,NA
"142","Wp0gIr-vW9MC","LD Hub: a centralized database and web interface to perform LD score regression that maximizes the potential of summary level GWAS data for SNP heritability and genetic …","J Zheng, AM Erzurumluoglu, BL Elsworth, JP Kemp, L Howe, PC Haycock, et al","Bioinformatics","33 (2), 272-279",809,2017,"17478279136807384039"
"143","HDshCWvjkbEC","Orienting the causal relationship between imprecisely measured traits using GWAS summary data","G Hemani, K Tilling, G Davey Smith","PLoS genetics","13 (11), e1007081",539,2017,"16670865041424319149,10560372126607873526"
"144","-f6ydRqryjwC","Association between telomere length and risk of cancer and non-neoplastic diseases: a Mendelian randomization study","PC Haycock, S Burgess, A Nounu, J Zheng, GN Okoli, J Bowden, et al","JAMA oncology","3 (5), 636-651",363,2017,"17112039741116860510"
"145","NaGl4SEjCO4C","Recent developments in Mendelian randomization studies","J Zheng, D Baird, MC Borges, J Bowden, G Hemani, P Haycock, et al","Current epidemiology reports","4 (4), 330-345",295,2017,"9350816392200281000"
"146","TFP_iSt0sucC","Estimating the causal influence of body mass index on risk of Parkinson disease: a Mendelian randomisation study","AJ Noyce, DA Kia, G Hemani, A Nicolas, TR Price, E De Pablo-Fernandez, et al","PLoS medicine","14 (6), e1002314",131,2017,"8496991259914731500"
"147","9Nmd_mFXekcC","Early Genetics and Lifecourse Epidemiology (EAGLE) Eczema Consortium. LD Hub: a centralized database and web interface to perform LD score regression that maximizes the …","J Zheng, AM Erzurumluoglu, BL Elsworth, JP Kemp, L Howe, PC Haycock, et al","Bioinformatics","33 (2), 272-279",91,2017,"6390307215221369367"
"148","JV2RwH3_ST0C","Automating Mendelian randomization through machine learning to construct a putative causal map of the human phenome","G Hemani, J Bowden, P Haycock, J Zheng, O Davis, P Flach, T Gaunt, et al","BioRxiv","173682",71,2017,"13564117679423315662"
"149","GnPB-g6toBAC","Mendelian randomization analysis identifies CpG sites as putative mediators for genetic influences on cardiovascular disease risk","TG Richardson, J Zheng, GD Smith, NJ Timpson, TR Gaunt, CL Relton, et al","The American Journal of Human Genetics","101 (4), 590-602",66,2017,"9488741613417641004"
"150","hMod-77fHWUC","The role of glycaemic and lipid risk factors in mediating the effect of BMI on coronary heart disease: a two-step, two-sample Mendelian randomisation study","L Xu, MC Borges, G Hemani, DA Lawlor","Diabetologia","60 (11), 2210-2220",60,2017,"766946919071776508"
"151","_5tno0g5mFcC","UK biobank genetic data: mrc-ieu quality control, version 1","R Mitchell, G Hemani, T Dudding, L Paternoster","University of Bristol","",55,2017,"12502998416354548328"
"152","sSrBHYA8nusC","MRC IEU UK Biobank GWAS pipeline version 1","B Elsworth, R Mitchell, CA Raistrick, L Paternoster, G Hemani, T Gaunt","Bristol, UK: University of Bristol","",37,2017,"12239346954976646161"
"153","NMxIlDl6LWMC","Genetic correlations reveal the shared genetic architecture of transcription in human peripheral blood","SW Lukowski, LR Lloyd-Jones, A Holloway, H Kirsten, G Hemani, J Yang, et al","Nature communications","8 (1), 1-10",15,2017,"1163373554844442149"
"154","maZDTaKrznsC","Investigating the role of insulin in increased adiposity: bi-directional Mendelian randomization study","RC Richmond, KH Wade, L Corbin, J Bowden, G Hemani, NJ Timpson, et al","BioRxiv","155739",9,2017,"16481305415785987833"
"155","blknAaTinKkC","Telomere Length and Risk of Cancer and Non-neoplastic Diseases: Is Survivin the Ariadne's Thread?—Reply","PC Haycock, G Hemani, A Aviv","JAMA oncology","3 (12), 1741-1742",6,2017,"4249271224410530618"
"156","j3f4tGmQtD8C","Causal epigenome-wide association study identifies CpG sites that influence cardiovascular disease risk","TG Richardson, J Zheng, GD Smith, NJ Timpson, TR Gaunt, CL Relton, et al","bioRxiv","132019",6,2017,"6065954787482706289"
"157","M3NEmzRMIkIC","Increased BMI May Protect against Parkinson's Disease: Evidence From Mendelian Randomisation Study","A Noyce, D Kia, G Hemani, A Nicolas, T Price, E Fernandez, P Haycock, et al","MOVEMENT DISORDERS","",0,2017,NA
"158","aqlVkmm33-oC","Systematic identification of genetic influences on methylation across the human life course","TR Gaunt, HA Shihab, G Hemani, JL Min, G Woodward, O Lyttleton, et al","Genome biology","17 (1), 1-14",486,2016,"9234354860860950510"
"159","dhFuZR0502QC","Genome-wide associations for birth weight and correlations with adult disease","M Horikoshi, RN Beaumont, FR Day, NM Warrington, MN Kooijman, et al","Nature","538 (7624), 248-252",387,2016,"11873769860050120960"
"160","TQgYirikUcIC","Two-sample Mendelian randomization: avoiding the downsides of a powerful, widely applicable but potentially fallible technique","FP Hartwig, NM Davies, G Hemani, G Davey Smith","International journal of epidemiology","45 (6), 1717-1726",307,2016,"10441421087766869259"
"161","YOwf2qJgpHMC","Prenatal and early life influences on epigenetic age in children: a study of mother–offspring pairs from two cohort studies","AJ Simpkin, G Hemani, M Suderman, TR Gaunt, O Lyttleton, WL Mcardle, et al","Human molecular genetics","25 (1), 191-201",163,2016,"5728300406059764223"
"162","4TOpqqG69KYC","Plasma urate concentration and risk of coronary heart disease: a Mendelian randomisation analysis","J White, R Sofat, G Hemani, T Shah, J Engmann, C Dale, S Shah, et al","The lancet Diabetes & endocrinology","4 (4), 327-336",132,2016,"9057129963115549866"
"163","mVmsd5A6BfQC","Challenges and novel approaches for investigating molecular mediation","RC Richmond, G Hemani, K Tilling, G Davey Smith, CL Relton","Human molecular genetics","25 (R2), R149-R156",91,2016,"9453423580618425551"
"164","O3NaXMp0MMsC","Genetic relationship between schizophrenia and nicotine dependence","J Chen, SA Bacanu, H Yu, Z Zhao, P Jia, KS Kendler, HR Kranzler, et al","Scientific reports","6 (1), 1-10",66,2016,"12660070882357253414"
"165","QIV2ME_5wuYC","Endometriosis risk alleles at 1p36. 12 act through inverse regulation of CDC42 and LINC00339","JE Powell, JN Fung, K Shakhbazov, Y Sapkota, N Cloonan, G Hemani, et al","Human molecular genetics","25 (22), 5046-5058",65,2016,"7419489745643186035"
"166","M3ejUd6NZC8C","Genome-wide meta-analysis of cotinine levels in cigarette smokers identifies locus at 4q13. 2","JJ Ware, X Chen, J Vink, A Loukola, C Minica, R Pool, Y Milaneschi, et al","Scientific reports","6 (1), 1-7",45,2016,"14759584759675752855"
"167","qxL8FJ1GzNcC","Evidence for genetic overlap between schizophrenia and age at first birth in women","D Mehta, FC Tropf, J Gratten, A Bakshi, Z Zhu, SA Bacanu, G Hemani, et al","JAMA psychiatry","73 (5), 497-505",42,2016,"267474646264240885"
"168","4DMP91E08xMC","Shared genetic control of expression and methylation in peripheral blood","K Shakhbazov, JE Powell, G Hemani, AK Henders, NG Martin, et al","BMC genomics","17 (1), 1-13",13,2016,"8445592800051287939"
"169","9ZlFYXVOiuMC","Collapsed methylation quantitative trait loci analysis for low frequency and rare variants","TG Richardson, HA Shihab, G Hemani, J Zheng, E Hannon, J Mill, et al","Human molecular genetics","25 (19), 4339-4349",11,2016,"1337551842076637978,1903200642819419264"
"170","qUcmZB5y_30C","LD hub and MR-base: online platforms for preforming LD score regression and Mendelian randomization analysis using GWAS summary data","J Zheng, P Haycock, G Hemani, B Elsworth, H Shihab, C Laurin, et al","Behavior Genetics","46 (6), 815-815",6,2016,"17623079326994583016"
"171","IWHjjKOFINEC","Genome-wide association study of 6,939 individuals identifies five novel loci and suggests that prenatal exposure to testosterone is not a major determinant of individual …","N Warrington, G Hemani, P Hysi, M Mangino, G McMahon, M Hickey, et al","Behavior Genetics","46 (6), 813-813",1,2016,"13390682095544610411"
"172","hC7cP41nSMkC","Detecting parent of origin effects using GREML of transmitted genotypes","C Laurin, G Hemani, D Evans","Behavior Genetics","46 (6), 792-793",0,2016,NA
"173","L8Ckcad2t8MC","Investigating DNA Methylation as a Marker for Historical Smoke Exposure and a Mediator of Disease Risk","RC Richmond, M Suderman, P Haycock, G Hemani, CL Relton, GD Smith","GENETIC EPIDEMIOLOGY","40 (7), 617-618",0,2016,NA
"174","KlAtU1dfN6UC","Genetic variance estimation with imputed variants finds negligible missing heritability for human height and body mass index","J Yang, A Bakshi, Z Zhu, G Hemani, AAE Vinkhuyzen, SH Lee, et al","Nature genetics","47 (10), 1114-1120",728,2015,"9730355260135351437"
"175","Zph67rFs4hoC","Population genetic differentiation of height and body mass index across Europe","MR Robinson, G Hemani, C Medina-Gomez, M Mezzavilla, T Esko, et al","Nature genetics","47 (11), 1357-1362",192,2015,"17335150694059718731"
"176","ufrVoPGSRksC","Dominance genetic variation contributes little to the missing heritability for human complex traits","Z Zhu, A Bakshi, AAE Vinkhuyzen, G Hemani, SH Lee, IM Nolte, et al","The American Journal of Human Genetics","96 (3), 377-385",184,2015,"307083007950779370"
"177","kNdYIx-mwKoC","Directional dominance on stature and cognition in diverse human populations","PK Joshi, T Esko, H Mattsson, N Eklund, I Gandin, T Nutile, AU Jackson, et al","Nature","523 (7561), 459-462",174,2015,"9099270425715378481"
"178","MXK_kJrjxJIC","The association between lower educational attainment and depression owing to shared genetic effects? Results in~ 25 000 subjects","WJ Peyrot, SH Lee, Y Milaneschi, A Abdellaoui, EM Byrne, T Esko, et al","Molecular psychiatry","20 (6), 735-743",69,2015,"1711125242218539343"
"179","ULOm3_A8WrAC","Genome-wide genetic homogeneity between sexes and populations for human height and body mass index","J Yang, A Bakshi, Z Zhu, G Hemani, AAE Vinkhuyzen, IM Nolte, et al","Human molecular genetics","24 (25), 7445-7449",55,2015,"9941858249466953375"
"180","8k81kl-MbHgC","Genome-wide association study of blood lead shows multiple associations near ALAD","NM Warrington, G Zhu, V Dy, AC Heath, PAF Madden, G Hemani, et al","Human molecular genetics","24 (13), 3871-3879",25,2015,"3082378505808288976"
"181","_kc_bZDykSQC","The role of common genetic variation in educational attainment and income: evidence from the National Child Development Study","NM Davies, G Hemani, NJ Timpson, F Windmeijer, G Davey Smith","Scientific Reports","5 (1), 1-12",15,2015,"13002405889632316518"
"182","2osOgNQ5qMEC","Defining the role of common variation in the genomic and biological architecture of adult human height","AR Wood, T Esko, J Yang, S Vedantam, TH Pers, S Gustafsson, AY Chu, et al","Nature genetics","46 (11), 1173-1186",1889,2014,"8626513868050362933"
"183","IjCSPb-OGe4C","Mendelian randomization: genetic anchors for causal inference in epidemiological studies","G Davey Smith, G Hemani","Human molecular genetics","23 (R1), R89-R98",1579,2014,"8711471820813605196"
"184","WF5omc3nYNoC","Detecting epistasis in human complex traits","WH Wei, G Hemani, CS Haley","Nature Reviews Genetics","15 (11), 722-733",417,2014,"17228070326686295063"
"185","qjMakFHDy7sC","Statistical power to detect genetic (co) variance of complex traits using SNP data in unrelated samples","PM Visscher, G Hemani, AAE Vinkhuyzen, GB Chen, SH Lee, NR Wray, et al","PLoS genetics","10 (4), e1004269",320,2014,"7889764746517428331"
"186","Y0pCki6q_DkC","Contribution of genetic variation to transgenerational inheritance of DNA methylation","AF McRae, JE Powell, AK Henders, L Bowdler, G Hemani, S Shah, et al","Genome biology","15 (5), 1-10",244,2014,"11569911084867673725"
"187","9yKSN-GCB0IC","Retracted article: Detection and replication of epistasis influencing transcription in humans","G Hemani, K Shakhbazov, HJ Westra, T Esko, AK Henders, AF McRae, et al","Nature","508 (7495), 249-253",211,2014,"2501475825993206590"
"188","W7OEmFMy1HYC","Novel risk loci for rheumatoid arthritis in Han Chinese and congruence with risk variants in Europeans","L Jiang, J Yin, L Ye, J Yang, G Hemani, A Liu, H Zou, D He, L Sun, X Zeng, et al","Arthritis & rheumatology","66 (5), 1121-1132",84,2014,"7596330627838018360,15505317099216509802"
"189","isC4tDSrTZIC","Hemani et al. reply","G Hemani, K Shakhbazov, HJ Westra, T Esko, AK Henders, AF McRae, et al","Nature","514 (7520), E5-E6",11,2014,"14815592887552602398"
"190","Se3iqnhoufwC","Another explanation for apparent epistasis","G Hemani, K Shakhbazov, HJ Westra, T Esko, AK Henders, AF McRae, et al","Nature","514 (7520), E5",2,2014,"13903973875902177082"
"191","WJVC3Jt7v1AC","Statistical Power to Detect Genetic (Co) Variance of Complex Traits Using SNP","PM Visscher, G Hemani, AAE Vinkhuyzen, GB Chen, SH Lee","","",0,2014,NA
"192","u-x6o8ySG0sC","An evolutionary perspective on epistasis and the missing heritability","G Hemani, S Knott, C Haley","PLoS genetics","9 (2), e1003295",143,2013,"2180227264170339147"
"193","zYLM7Y9cAGgC","Inference of the genetic architecture underlying BMI and height with the use of 20,240 sibling pairs","G Hemani, J Yang, A Vinkhuyzen, JE Powell, G Willemsen, JJ Hottenga, et al","The American Journal of Human Genetics","93 (5), 865-875",110,2013,"13456851428784183203"
"194","UeHWp8X0CEIC","Congruence of additive and non-additive effects on gene expression estimated from pedigree and SNP data","JE Powell, AK Henders, AF McRae, J Kim, G Hemani, NG Martin, et al","PLoS genetics","9 (5), e1003502",96,2013,"3625227134798665850"
"195","k_IJM867U9cC","Response to Lee et al.: SNP-based heritability analysis with dense data","D Speed, G Hemani, MR Johnson, DJ Balding","The American Journal of Human Genetics","93 (6), 1155-1157",20,2013,"16419366823364823561"
"196","u5HHmVD_uO8C","Improved heritability estimation from genome-wide SNPs","D Speed, G Hemani, MR Johnson, DJ Balding","The American Journal of Human Genetics","91 (6), 1011-1021",625,2012,"1470931498593535858"
"197","eQOLeE2rZwMC","Genome-wide analysis of mitral valve disease in Cavalier King Charles Spaniels","AT French, R Ogden, C Eland, G Hemani, R Pong-Wong, B Corcoran, et al","The veterinary journal","193 (1), 283-286",35,2012,"6918165933974541538"
"198","0EnyYjriUFMC","Genome-wide analysis of epistasis in body mass index using multiple human populations","WH Wei, G Hemani, A Gyenesei, V Vitart, P Navarro, C Hayward, et al","European Journal of Human Genetics","20 (8), 857-862",34,2012,"15066659272962911913"
"199","roLk4NBRz8UC","Dissecting genetic interactions in complex traits","G Hemani","The University of Edinburgh","",0,2012,NA
"200","d1gkVwhDpl0C","EpiGPU: exhaustive pairwise epistasis scans parallelized on consumer level graphics cards","G Hemani, A Theocharidis, W Wei, C Haley","Bioinformatics","27 (11), 1462-1465",108,2011,"8103593170298128206"
